title,author,original_publish_date,rating,number_of_ratings,number_of_pages,number_of_reviews,genres
The New Centurions,Joseph Wambaugh,"January 1, 1970",3.95,4156,368,152,"Fiction, Crime, Mystery, Thriller, Police, Procedural, Mystery Thriller"
Anil's Ghost,Michael Ondaatje,"March 30, 2000",3.59,19042,311,1610,"Fiction, Historical Fiction, Canada, Literary Fiction, Asia, Literature, Book Club"
No One Writes to the Colonel and Other Stories,Gabriel García Márquez,"January 1, 1961",3.88,15374,170,533,"Fiction, Short Stories, Classics, Magical Realism, Latin American, Literature, Spanish Literature"
John Carter of Mars,Edgar Rice Burroughs,"January 1, 1943",3.83,4673,167,148,"Science Fiction, Fantasy, Fiction, Classics, Adventure, Pulp, Sword and Planet"
The Little Engine That Could,Watty Piper,"January 1, 1930",4.20,117089,48,1898,"Picture Books, Childrens, Classics, Fiction, Trains, Kids, Fantasy"
The Rogue Kingdom: An Espionage Thriller About the US and North Korea,Stephen Steighner,"July 5, 2018",3.63,32,385,1,
The Selected Poems,Federico García Lorca,"January 1, 1936",4.31,9282,186,275,"Poetry, Classics, Spain, Spanish Literature, Fiction, Literature, 20th Century"
The Shadow over Innsmouth,H.P. Lovecraft,"April 1, 1936",4.10,28571,158,2330,"Horror, Fiction, Classics, Fantasy, Lovecraftian, Short Stories, Audiobook"
The Chessmen of Mars,Edgar Rice Burroughs,"November 1, 1922",3.83,8221,5,351,"Science Fiction, Fantasy, Fiction, Classics, Adventure, Pulp, Science Fiction Fantasy"
Spyder Bones,Oliver Phipps,"September 16, 2018",4.77,147,173,72,Love
The Grand Inquisitor,Fyodor Dostoevsky,"January 1, 1879",4.32,7552,32,536,"Classics, Fiction, Philosophy, Russian Literature, Russia, Literature, Short Stories"
La dama de las camelias,Alexandre Dumas fils,"January 1, 1848",4.05,62826,90,5144,"Classics, Romance, Fiction, France, French Literature, Historical Fiction, 19th Century"
Unforgiving Years,Victor Serge,"January 1, 1971",4.07,572,341,85,"Fiction, Russia, Historical Fiction, Russian Literature, Novels, War, 20th Century"
Presumed Innocent,Scott Turow,"August 1, 1987",4.09,126952,496,2965,"Mystery, Fiction, Thriller, Crime, Legal Thriller, Mystery Thriller, Suspense"
Amusing Ourselves to Death: Public Discourse in the Age of Show Business,Neil Postman,"November 25, 1985",4.17,39472,184,5370,"Nonfiction, Philosophy, Sociology, Politics, Psychology, Cultural, Technology"
Reality Check,Veekay,"June 16, 2018",4.00,4,248,3,
The Case of Comrade Tulayev,Victor Serge,"January 1, 1948",4.12,1629,400,209,"Fiction, Russia, Classics, Historical Fiction, Russian Literature, Literature, Novels"
Black Cross,Greg Iles,"January 28, 1995",4.24,13783,556,743,"Historical Fiction, Fiction, Thriller, War, World War II, Historical, Mystery"
Tarzan at the Earth's Core,Edgar Rice Burroughs,"January 1, 1929",3.87,2204,310,117,"Fantasy, Adventure, Fiction, Science Fiction, Classics, Pulp, Action"
The War of the End of the World,Mario Vargas Llosa,"October 1, 1981",4.25,12923,568,1178,"Fiction, Historical Fiction, Literature, Novels, Latin American, Classics, Nobel Prize"
Tarzan the Terrible,Edgar Rice Burroughs,"September 1, 1921",3.81,2784,284,135,"Adventure, Fantasy, Fiction, Classics, Pulp, Science Fiction, Action"
Outland Exile,W. Clark Boutwell,"October 21, 2015",4.32,99,394,57,"Science Fiction, Fantasy, Fiction, Post Apocalyptic"
A Civil Contract,Georgette Heyer,"January 1, 1961",3.88,9811,375,1035,"Romance, Historical Fiction, Regency, Historical Romance, Historical, Fiction, Regency Romance"
Lark Rise to Candleford,Flora Thompson,"January 1, 1939",4.02,5018,537,524,"Classics, Fiction, Historical Fiction, Historical, British Literature, 19th Century, Literature"
Pantaleón y las visitadoras,Mario Vargas Llosa,"May 1, 1973",3.97,13242,392,822,"Fiction, Latin American, Spanish Literature, Humor, Nobel Prize, Novels, Latin American Literature"
Tarzan the Untamed,Edgar Rice Burroughs,"January 1, 1919",3.82,3239,154,139,"Adventure, Fantasy, Fiction, Classics, Pulp, Action, Africa"
Hit the Ground Running,Jeston Texeira,"July 5, 2018",5.00,4,56,0,
The Grass Is Singing,Doris Lessing,"January 1, 1950",3.83,15339,208,1494,"Fiction, Africa, Classics, Historical Fiction, Nobel Prize, South Africa, Literature"
Walkabout,James Vance Marshall,"January 1, 1959",3.50,2830,128,301,"Fiction, Australia, Young Adult, Adventure, Classics, Survival, Childrens"
Strong Motion,Jonathan Franzen,"January 1, 1992",3.54,6235,528,478,"Fiction, Novels, Literary Fiction, Contemporary, Literature, American, The United States Of America"
Aunt Julia and the Scriptwriter,Mario Vargas Llosa,"March 1, 1977",3.96,24024,374,1819,"Fiction, Latin American, Spanish Literature, Nobel Prize, Classics, Novels, Latin American Literature"
Masterman Ready,Frederick Marryat,"January 1, 1841",3.83,237,290,18,"Fiction, Classics, Adventure, Historical Fiction, Nautical, British Literature, Childrens"
Tarzan and the Jewels of Opar,Edgar Rice Burroughs,"July 1, 1916",3.83,4346,264,212,"Adventure, Fiction, Fantasy, Classics, Pulp, Action, Science Fiction"
The Last Child - Part 1,Sean Kerr,"April 21, 2018",4.57,14,187,7,Horror
The Conservationist,Nadine Gordimer,"January 1, 1974",3.31,3379,267,427,"Fiction, Africa, South Africa, Nobel Prize, Novels, Literature, Literary Fiction"
The Twenty-Seventh City,Jonathan Franzen,"January 1, 1988",3.13,5353,528,531,"Fiction, Novels, Literary Fiction, Literature, Contemporary, American, Unfinished"
La ciudad y los perros,Mario Vargas Llosa,"January 1, 1962",4.18,29057,446,1916,"Fiction, Spanish Literature, Classics, Nobel Prize, Latin American, Literature, Latin American Literature"
Tarzan of the Apes and Other Works,Edgar Rice Burroughs,"October 1, 2010",3.43,14,Nook,2,
You Are Going To Die,R.L. George,"March 14, 2018",4.00,4,185,1,
The King of the Fields,Isaac Bashevis Singer,"January 1, 1988",3.61,239,256,35,"Fiction, Poland, Novels, Polish Literature, American, Historical Fiction, Literature"
Foxe's Book of Martyrs,John Foxe,"January 1, 1563",4.27,20009,416,563,"History, Christian, Biography, Nonfiction, Religion, Christianity, Classics"
Kenilworth,Walter  Scott,"October 15, 1993",3.70,1094,541,122,"Classics, Historical Fiction, Fiction, Romance, Historical, 19th Century, Scotland"
The People That Time Forgot,Edgar Rice Burroughs,"January 1, 1918",3.69,2604,100,174,"Science Fiction, Fantasy, Fiction, Classics, Adventure, Pulp, Audiobook"
Machine Intelligence in Design Automation,Rohit Sharma,"March 13, 2018",5.00,4,221,2,
Catherine De Medici,Alexandre Dumas,"January 1, 1845",4.16,297,292,12,"Classics, Historical Fiction, France, French Literature, Historical"
The World's Best Fairy Tales,Belle Becker Sideman,"January 1, 1967",4.37,300,828,27,"Fairy Tales, Fantasy, Classics, Fiction, Short Stories, Childrens, Anthologies"
"Horseman, Pass By",Larry McMurtry,"January 1, 1961",3.93,5630,192,566,"Fiction, Westerns, Historical Fiction, Classics, Coming Of Age, Novels, Literature"
Underworld,Don DeLillo,"October 3, 1997",3.95,34148,827,2820,"Fiction, Novels, Literature, Literary Fiction, Classics, American, Historical Fiction"
Common Sense,Thomas Paine,"January 1, 1776",4.00,40063,104,2635,"History, Nonfiction, Classics, Philosophy, Politics, American History, Historical"
Tarzan and the Lost Empire,Edgar Rice Burroughs,"January 1, 1928",3.76,1642,160,74,"Fantasy, Adventure, Fiction, Classics, Pulp, Action, Science Fiction"
Cold Mountain,Charles Frazier,"January 1, 1997",3.89,250834,449,7200,"Historical Fiction, Fiction, Historical, Romance, Civil War, War, Classics"
Fake Atheism: The Suppression of the Truth and the Atheist Syndrome,Mike A. Robinson,"February 11, 2018",3.00,2,242,1,
Thaïs,Anatole France,"January 1, 1890",3.68,1657,175,226,"Fiction, Classics, France, French Literature, Historical Fiction, Novels, Religion"
The Colour Out of Space,H.P. Lovecraft,"March 1, 1927",4.05,21567,78,2113,"Horror, Short Stories, Fiction, Classics, Science Fiction, Lovecraftian, Fantasy"
Martin Luther's Ninety-Five Theses,Martin Luther,"October 31, 1517",3.90,2503,348,227,"Religion, History, Theology, Classics, Nonfiction, Philosophy, Christianity"
The Black Cat,Edgar Allan Poe,"January 1, 1843",4.03,58308,24,4837,"Classics, Horror, Short Stories, Fiction, Gothic, Mystery, School"
La reina estrangulada,Maurice Druon,"January 1, 1955",4.17,12961,230,714,"Historical Fiction, Fiction, Historical, France, Medieval, Classics, Fantasy"
Tarzan and the Forbidden City,Edgar Rice Burroughs,"January 1, 1938",3.72,1556,191,56,"Fantasy, Adventure, Fiction, Classics, Action, Pulp, Science Fiction"
Rolf in the Woods: The Adventures of a Boy Scout With Indian Quonab and Little Dog Skookum,Ernest Thompson Seton,"January 1, 1911",4.26,198,472,16,"Young Adult, Historical Fiction, Adventure, Classics, Fiction"
Incognito: The More Things Change,Paul Sunn,"June 28, 2018",5.00,2,55,0,
Penguin Island,Anatole France,"January 1, 1908",3.65,2266,280,302,"Fiction, Classics, France, French Literature, Literature, Nobel Prize, Satire"
Queen of Scots: The True Life of Mary Stuart,John Guy,"January 19, 2004",3.94,5533,560,537,"History, Nonfiction, Biography, Scotland, Historical, Royalty, Audiobook"
Pierre: A Cautionary Tale in Five Chapters and a Prologue,Maurice Sendak,"January 1, 1962",4.26,9925,48,281,"Picture Books, Childrens, Fiction, Poetry, Classics, Humor, Fantasy"
Spring Awakening,Frank Wedekind,"October 1, 1891",3.81,14527,71,785,"Plays, Classics, Drama, Theatre, German Literature, Fiction, School"
Leaving Cheyenne,Larry McMurtry,"January 1, 1962",4.06,4190,304,363,"Fiction, Westerns, Historical Fiction, Historical, Literature, Novels, Audiobook"
Jassy,Norah Lofts,"January 1, 1944",4.02,363,255,37,"Historical Fiction, Fiction, Gothic, Fantasy, Historical, Horror, Romance"
Indian Boyhood,Charles Alexander Eastman,"January 1, 1902",4.07,414,150,47,"History, Nonfiction, Memoir, Native American, Biography, Indigenous, Classics"
Stories Of Legends Who Shaped Our Lives-Legends Over Generations,Ashraf Haggag,"May 4, 2018",4.00,4,Kindle,3,
Riders in the Chariot,Patrick White,"January 1, 1961",4.00,1027,643,135,"Fiction, Australia, Classics, Novels, Literature, 20th Century, Nobel Prize"
Rinkitink in Oz,L. Frank Baum,"June 20, 1916",3.77,6993,318,373,"Fantasy, Classics, Childrens, Fiction, Young Adult, Adventure, Ebooks"
"The Last Days of Disco, With Cocktails at Petrossian Afterwards",Whit Stillman,"January 1, 2000",3.85,305,339,42,"Fiction, New York, Film, Novels, Adult Fiction, Literary Fiction"
The Autumn of the Patriarch,Gabriel García Márquez,"January 1, 1975",3.86,26961,255,2097,"Fiction, Classics, Magical Realism, Novels, Literature, Latin American, Latin American Literature"
Tarzan Triumphant,Edgar Rice Burroughs,"January 1, 1931",3.72,1311,192,53,"Fantasy, Adventure, Fiction, Classics, Pulp, Science Fiction, Thriller"
Kill Irish,Mayi Ngwala,"February 28, 2018",4.61,46,276,3,Fiction
Un señor muy viejo con unas alas enormes,Gabriel García Márquez,"January 1, 1955",3.83,6372,28,629,"Short Stories, Fiction, Magical Realism, Classics, Fantasy, School, Read For School"
Tarzan the Invincible,Edgar Rice Burroughs,"January 1, 1930",3.73,1359,192,51,"Adventure, Fantasy, Fiction, Classics, Pulp, Science Fiction, Action"
The Spread,Lamont R. Chatman,"May 30, 2018",3.86,7,Kindle,0,
La hojarasca,Gabriel García Márquez,"January 1, 1955",3.66,17001,176,1393,"Fiction, Classics, Magical Realism, Spanish Literature, Nobel Prize, Latin American Literature, Latin American"
The Congo and Other Poems,Vachel Lindsay,"January 1, 1914",3.74,91,96,10,"Poetry, Africa, Classics, Nonfiction"
Miss Buncle's Book,D.E. Stevenson,"January 1, 1934",4.12,14221,448,2484,"Fiction, Classics, Historical Fiction, Humor, Romance, British Literature, Book Club"
The Prospector,J.M.G. Le Clézio,"January 1, 1985",3.77,1394,338,188,"Fiction, Nobel Prize, France, Historical Fiction, Mauritius, Novels, Africa"
Eva Luna,Isabel Allende,"January 1, 1987",4.01,59921,307,2906,"Fiction, Magical Realism, Historical Fiction, Classics, Romance, Spanish Literature, Latin American"
Allan Quatermain,H. Rider Haggard,"January 1, 1887",3.89,5477,204,315,"Adventure, Classics, Fiction, Fantasy, Africa, Historical Fiction, Thriller"
Out of Time's Abyss,Edgar Rice Burroughs,"November 1, 1918",3.61,1803,136,136,"Science Fiction, Fantasy, Fiction, Adventure, Classics, Pulp, Audiobook"
Confessions of a quarter life crisis,T'Shara Tabron,"May 9, 2018",5.00,1,214,0,
Diatriba de amor contra un hombre sentado: Monólogo en un acto,Gabriel García Márquez,"January 1, 1987",3.83,1363,69,217,"Plays, Literature, Drama, Classics, Spanish Literature, Theatre, Short Stories"
The Heirs of the Kingdom,Zoé Oldenbourg,"January 1, 1970",4.11,88,563,16,"Historical Fiction, Fiction, Classics, Medieval, Historical, Fantasy"
The Princess and Curdie,George MacDonald,"January 1, 1883",4.08,10867,Audio,807,"Fantasy, Classics, Fiction, Childrens, Fairy Tales, Christian, Middle Grade"
The Last Question,Isaac Asimov,"November 1, 1956",4.53,30667,9,2528,"Science Fiction, Short Stories, Fiction, Classics, Philosophy, Audiobook, Literature"
Lost on Venus,Edgar Rice Burroughs,"January 1, 1935",3.78,1308,192,90,"Science Fiction, Fantasy, Fiction, Pulp, Adventure, Sword and Planet, Classics"
Zoey Searches for Zero,Jennifer Jayne Scobie,"January 22, 2018",5.00,1,24,0,
Innocent Erendira and Other Stories,Gabriel García Márquez,"January 1, 1972",3.89,22679,183,1575,"Short Stories, Fiction, Magical Realism, Classics, Spanish Literature, Literature, Latin American"
Herbert West—Reanimator,H.P. Lovecraft,"June 1, 1922",3.82,8173,35,791,"Horror, Short Stories, Fiction, Classics, Lovecraftian, Science Fiction, Audiobook"
In a Dark Wood Wandering: A Novel of the Middle Ages,Hella S. Haasse,"January 1, 1949",4.10,2723,592,303,"Historical Fiction, Fiction, Medieval, Historical, France, Classics, Dutch Literature"
Tarzan and the Leopard Men,Edgar Rice Burroughs,"January 1, 1935",3.67,1246,35,49,"Fantasy, Adventure, Fiction, Classics, Action, Pulp, Science Fiction"
Great Maria,Cecelia Holland,"January 1, 1974",4.08,615,519,78,"Historical Fiction, Fiction, Historical, Italy, Medieval, Romance, Historical Romance"
The Catbird Seat,James Thurber,"November 14, 1942",3.85,455,32,61,"Short Stories, Fiction, Humor, Classics, School, 20th Century, Adult Fiction"
A Modest Proposal,Jonathan Swift,"January 1, 1729",4.02,49616,48,2451,"Classics, Fiction, Satire, Essays, Humor, Short Stories, Philosophy"
Inherit the Wind: The Powerful Courtroom Drama in which Two Men Wage the Legal War of the Century,Jerome Lawrence,"January 1, 1955",3.93,24264,129,1090,"Plays, Classics, Fiction, Historical Fiction, Drama, School, Theatre"
Admiral Hornblower in the West Indies,C.S. Forester,"January 1, 1957",4.17,6348,336,239,"Historical Fiction, Fiction, Historical, Adventure, Classics, Nautical, War"
Tarzan and the Lion Man,Edgar Rice Burroughs,"January 1, 1934",3.68,1249,192,53,"Fantasy, Adventure, Fiction, Classics, Pulp, Action, Science Fiction"
Through a Glass Darkly,Karleen Koen,"July 12, 1986",3.98,11421,674,909,"Historical Fiction, Fiction, Historical, Romance, Historical Romance, British Literature, 18th Century"
Point Counter Point,Aldous Huxley,"January 1, 1928",3.86,12299,432,500,"Fiction, Classics, Literature, Philosophy, Novels, British Literature, 20th Century"
Snow,Orhan Pamuk,"January 1, 2002",3.62,49911,463,4578,"Fiction, Contemporary, Literature, Turkish, Historical Fiction, Turkish Literature, Novels"
Eye of the Needle,Ken Follett,"May 23, 1978",4.22,171135,368,4934,"Fiction, Historical Fiction, Thriller, Mystery, Espionage, War, Mystery Thriller"
Lord Hornblower,C.S. Forester,"January 1, 1946",4.12,7665,293,291,"Historical Fiction, Fiction, Historical, Adventure, Classics, Nautical, War"
Tarzan and the Golden Lion,Edgar Rice Burroughs,"January 1, 1923",3.77,1856,191,96,"Adventure, Fantasy, Fiction, Classics, Pulp, Action, Africa"
Bilbo the Clown Fights Evil,T. Thornton Gray,"October 5, 2016",4.00,12,112,3,
Los intereses creados,Jacinto Benavente,"December 9, 1907",3.47,875,120,112,"Nobel Prize, Plays, Spain, Fiction, Spanish Literature, Classics, Drama"
The City of Joy,Dominique Lapierre,"January 1, 1985",4.27,8442,552,691,"India, Fiction, Historical Fiction, Novels, Travel, Asia, France"
The Bronze Horseman,Paullina Simons,"July 17, 2000",4.29,96825,656,10136,"Historical Fiction, Romance, Historical, Historical Romance, Fiction, War, Russia"
Rip Van Winkle,Washington Irving,"January 1, 1819",3.60,19035,61,1149,"Classics, Short Stories, Fiction, Fantasy, School, American, Literature"
The Varieties of Religious Experience,William  James,"January 1, 1902",3.99,13188,608,694,"Philosophy, Religion, Psychology, Nonfiction, Spirituality, Classics, Theology"
Hornblower and the Hotspur,C.S. Forester,"January 1, 1962",4.32,12141,394,461,"Historical Fiction, Fiction, Adventure, Historical, Classics, War, Nautical"
"Tarzan, Lord of the Jungle",Edgar Rice Burroughs,"September 15, 1928",3.80,1905,191,78,"Adventure, Fantasy, Fiction, Classics, Pulp, Action, Science Fiction"
The Jade Rebellion,Alanna Mackenzie,"April 22, 2018",4.00,22,204,16,Science Fiction
María,Jorge Isaacs,"January 1, 1867",3.53,7786,373,680,"Classics, Romance, Fiction, Spanish Literature, Novels, Literature, Latin American"
Black Robe,Brian Moore,"January 1, 1985",3.78,1516,256,177,"Historical Fiction, Fiction, Canada, Religion, Irish Literature, Native American, Novels"
The Poems of Gerard Manley Hopkins,Gerard Manley Hopkins,"January 1, 1918",4.28,1859,428,80,"Poetry, Classics, Literature, Fiction, Religion, Spirituality, Victorian"
"Carry On, Jeeves",P.G. Wodehouse,"January 1, 1925",4.25,27628,273,1971,"Fiction, Humor, Classics, Short Stories, Comedy, Audiobook, British Literature"
The White Album,Joan Didion,"January 1, 1979",4.02,51197,224,6049,"Nonfiction, Essays, Memoir, Classics, History, Journalism, Biography"
Lieutenant Hornblower,C.S. Forester,"June 1, 1952",4.32,13698,320,601,"Historical Fiction, Fiction, Adventure, Historical, Classics, Nautical, War"
Misborn of the Snowy Reaches,L.E. Parr,"July 5, 2017",5.00,5,317,0,
Don Juan Tenorio,José Zorrilla,"January 1, 1844",3.63,10453,219,612,"Classics, Plays, Spanish Literature, Drama, Theatre, Fiction, School"
The Merry Adventures of Robin Hood,Howard Pyle,"January 1, 1883",4.07,67219,398,1691,"Classics, Fiction, Historical Fiction, Adventure, Fantasy, Childrens, Literature"
Accordion Crimes,Annie Proulx,"June 19, 1996",3.60,7857,384,732,"Fiction, Historical Fiction, Short Stories, Literary Fiction, Music, American, Book Club"
We Tell Ourselves Stories in Order to Live: Collected Nonfiction,Joan Didion,"October 17, 2006",4.43,2157,1122,149,"Nonfiction, Essays, Memoir, Short Stories, Journalism, Classics, Biography"
How to Live with a Psychic: Your Guide for Maintaining a Happy Relationship when Someone You Love Gets Weird,Crystal Hope Reed,"January 27, 2017",4.38,8,230,1,
She Walks These Hills,Sharyn McCrumb,"January 1, 1994",4.11,4446,448,321,"Mystery, Fiction, Historical Fiction, Mystery Thriller, Southern, Suspense, Historical"
Democracy,Joan Didion,"January 1, 1984",3.85,4416,234,589,"Fiction, Politics, Historical Fiction, Literary Fiction, Novels, Literature, American"
Scaramouche,Rafael Sabatini,"January 1, 1921",4.10,9316,359,927,"Classics, Historical Fiction, Fiction, Adventure, Historical, France, Romance"
Miracle Fair: Selected Poems of Wisława Szymborska,Wisława Szymborska,"May 1, 2001",4.39,631,159,64,"Poetry, Poland, Polish Literature, Nobel Prize, Literature, Contemporary"
100 Selected Poems,E.E. Cummings,"January 1, 1923",4.28,29422,121,729,"Poetry, Classics, Fiction, Literature, 20th Century, American, The United States Of America"
The Boys from Brazil,Ira Levin,"January 1, 1976",4.05,41032,280,1422,"Fiction, Thriller, Horror, Science Fiction, Mystery, Historical Fiction, Classics"
Miami,Joan Didion,"January 1, 1987",3.66,3173,240,399,"Nonfiction, Essays, Politics, History, Journalism, 20th Century, American History"
Sirenhawk Book 2: Misborn of the Wilding River,L.E. Parr,"December 17, 2017",4.75,4,474,0,
The Old Capital,Yasunari Kawabata,"January 31, 1962",3.73,8002,160,946,"Japan, Fiction, Japanese Literature, Classics, Historical Fiction, Literature, Asia"
Downright Dencey,Caroline Dale Snedeker,"January 1, 1927",3.78,335,274,43,"Historical Fiction, Childrens, Fiction, Middle Grade, Classics, Juvenile, Young Adult"
Peyton Place,Grace Metalious,"January 1, 1956",3.81,13504,384,1336,"Fiction, Classics, Book Club, Romance, Historical Fiction, Banned Books, Novels"
Political Fictions,Joan Didion,"January 1, 2001",3.86,1694,338,215,"Nonfiction, Politics, Essays, History, Journalism, Female Authors, Historical"
Sor Juana's Love Poems,Juana Inés de la Cruz,"October 1, 1997",4.29,174,88,25,"Poetry, Classics, LGBT, Lesbian, Spanish Literature, Romance"
The Nutmeg Tree,Margery Sharp,"January 1, 1937",3.77,935,313,168,"Fiction, Romance, Humor, France, Classics, British Literature, Historical Fiction"
The Tower Treasure,Franklin W. Dixon,"January 1, 1927",3.91,20345,214,1373,"Mystery, Fiction, Young Adult, Childrens, Classics, Adventure, Middle Grade"
OKINAWA DIET: THE LONGEVITY SECRET,Marco Coni,"May 11, 2018",4.97,59,200,21,"Health, Japan, Nonfiction"
Confederates,Thomas Keneally,"January 1, 1979",4.09,1364,427,103,"Historical Fiction, Fiction, Civil War, American Civil War, Historical, Australia, War"
Rocket Boys,Homer Hickam,"January 1, 1998",4.21,24353,368,2435,"Nonfiction, Memoir, Biography, Science, History, Biography Memoir, Space"
The Cancer Quandary: A Thirty eight year survival journey,Jay Lynne,"April 30, 2018",5.00,1,130,0,
Eclipse of the Sun,Michael D. O'Brien,"December 1, 1997",4.44,882,857,75,"Fiction, Catholic, Christian Fiction, Christian, Religion, Spirituality, Adult Fiction"
A Game of Thrones,George R.R. Martin,"August 6, 1996",4.45,2759733,835,73116,"Fantasy, Fiction, Epic Fantasy, High Fantasy, Adult, Audiobook, Science Fiction Fantasy"
Bartleby the Scrivener,Herman Melville,"December 1, 1853",3.93,76850,64,7186,"Classics, Fiction, Short Stories, Literature, American, 19th Century, School"